[
  {
    "parameter_id": "AE_LFP.Cell.Ambient temperature [K]",
    "dataset_id": "AE_LFP",
    "section": "Cell",
    "name": "Ambient temperature [K]",
    "value": 298.15,
    "unit": "K",
    "evidence_type": "mixed_not_resolved",
    "source_id": "S01",
    "source_blob_sha1": "bc4aa47b2747ccad2088b9b7cd7baf58298799d5",
    "uncertainty": null,
    "validity_domain": null,
    "note": "Source supplies no per-parameter uncertainty; do not interpret decimals as accuracy."
  },
  {
    "parameter_id": "AE_LFP.Cell.Initial temperature [K]",
    "dataset_id": "AE_LFP",
    "section": "Cell",
    "name": "Initial temperature [K]",
    "value": 298.15,
    "unit": "K",
    "evidence_type": "mixed_not_resolved",
    "source_id": "S01",
    "source_blob_sha1": "bc4aa47b2747ccad2088b9b7cd7baf58298799d5",
    "uncertainty": null,
    "validity_domain": null,
    "note": "Source supplies no per-parameter uncertainty; do not interpret decimals as accuracy."
  },
  {
    "parameter_id": "AE_LFP.Cell.Reference temperature [K]",
    "dataset_id": "AE_LFP",
    "section": "Cell",
    "name": "Reference temperature [K]",
    "value": 298.15,
    "unit": "K",
    "evidence_type": "mixed_not_resolved",
    "source_id": "S01",
    "source_blob_sha1": "bc4aa47b2747ccad2088b9b7cd7baf58298799d5",
    "uncertainty": null,
    "validity_domain": null,
    "note": "Source supplies no per-parameter uncertainty; do not interpret decimals as accuracy."
  },
  {
    "parameter_id": "AE_LFP.Cell.Lower voltage cut-off [V]",
    "dataset_id": "AE_LFP",
    "section": "Cell",
    "name": "Lower voltage cut-off [V]",
    "value": 2.0,
    "unit": "V",
    "evidence_type": "mixed_not_resolved",
    "source_id": "S01",
    "source_blob_sha1": "bc4aa47b2747ccad2088b9b7cd7baf58298799d5",
    "uncertainty": null,
    "validity_domain": null,
    "note": "Source supplies no per-parameter uncertainty; do not interpret decimals as accuracy."
  },
  {
    "parameter_id": "AE_LFP.Cell.Upper voltage cut-off [V]",
    "dataset_id": "AE_LFP",
    "section": "Cell",
    "name": "Upper voltage cut-off [V]",
    "value": 3.65,
    "unit": "V",
    "evidence_type": "mixed_not_resolved",
    "source_id": "S01",
    "source_blob_sha1": "bc4aa47b2747ccad2088b9b7cd7baf58298799d5",
    "uncertainty": null,
    "validity_domain": null,
    "note": "Source supplies no per-parameter uncertainty; do not interpret decimals as accuracy."
  },
  {
    "parameter_id": "AE_LFP.Cell.Nominal cell capacity [A.h]",
    "dataset_id": "AE_LFP",
    "section": "Cell",
    "name": "Nominal cell capacity [A.h]",
    "value": 2,
    "unit": "A.h",
    "evidence_type": "mixed_not_resolved",
    "source_id": "S01",
    "source_blob_sha1": "bc4aa47b2747ccad2088b9b7cd7baf58298799d5",
    "uncertainty": null,
    "validity_domain": null,
    "note": "Source supplies no per-parameter uncertainty; do not interpret decimals as accuracy."
  },
  {
    "parameter_id": "AE_LFP.Cell.Specific heat capacity [J.K-1.kg-1]",
    "dataset_id": "AE_LFP",
    "section": "Cell",
    "name": "Specific heat capacity [J.K-1.kg-1]",
    "value": 999,
    "unit": "J.K-1.kg-1",
    "evidence_type": "estimated",
    "source_id": "S01",
    "source_blob_sha1": "bc4aa47b2747ccad2088b9b7cd7baf58298799d5",
    "uncertainty": null,
    "validity_domain": null,
    "note": "Source header says other thermal properties are estimated."
  },
  {
    "parameter_id": "AE_LFP.Cell.Thermal conductivity [W.m-1.K-1]",
    "dataset_id": "AE_LFP",
    "section": "Cell",
    "name": "Thermal conductivity [W.m-1.K-1]",
    "value": 1.89,
    "unit": "W.m-1.K-1",
    "evidence_type": "estimated",
    "source_id": "S01",
    "source_blob_sha1": "bc4aa47b2747ccad2088b9b7cd7baf58298799d5",
    "uncertainty": null,
    "validity_domain": null,
    "note": "Source header says other thermal properties are estimated."
  },
  {
    "parameter_id": "AE_LFP.Cell.Density [kg.m-3]",
    "dataset_id": "AE_LFP",
    "section": "Cell",
    "name": "Density [kg.m-3]",
    "value": 1940,
    "unit": "kg.m-3",
    "evidence_type": "estimated",
    "source_id": "S01",
    "source_blob_sha1": "bc4aa47b2747ccad2088b9b7cd7baf58298799d5",
    "uncertainty": null,
    "validity_domain": null,
    "note": "Source header says other thermal properties are estimated."
  },
  {
    "parameter_id": "AE_LFP.Cell.Electrode area [m2]",
    "dataset_id": "AE_LFP",
    "section": "Cell",
    "name": "Electrode area [m2]",
    "value": 0.08959998,
    "unit": "m2",
    "evidence_type": "mixed_not_resolved",
    "source_id": "S01",
    "source_blob_sha1": "bc4aa47b2747ccad2088b9b7cd7baf58298799d5",
    "uncertainty": null,
    "validity_domain": null,
    "note": "Source supplies no per-parameter uncertainty; do not interpret decimals as accuracy."
  },
  {
    "parameter_id": "AE_LFP.Cell.Number of electrode pairs connected in parallel to make a cell",
    "dataset_id": "AE_LFP",
    "section": "Cell",
    "name": "Number of electrode pairs connected in parallel to make a cell",
    "value": 1,
    "unit": null,
    "evidence_type": "mixed_not_resolved",
    "source_id": "S01",
    "source_blob_sha1": "bc4aa47b2747ccad2088b9b7cd7baf58298799d5",
    "uncertainty": null,
    "validity_domain": null,
    "note": "Source supplies no per-parameter uncertainty; do not interpret decimals as accuracy."
  },
  {
    "parameter_id": "AE_LFP.Cell.External surface area [m2]",
    "dataset_id": "AE_LFP",
    "section": "Cell",
    "name": "External surface area [m2]",
    "value": 0.00431,
    "unit": "m2",
    "evidence_type": "mixed_not_resolved",
    "source_id": "S01",
    "source_blob_sha1": "bc4aa47b2747ccad2088b9b7cd7baf58298799d5",
    "uncertainty": null,
    "validity_domain": null,
    "note": "Source supplies no per-parameter uncertainty; do not interpret decimals as accuracy."
  },
  {
    "parameter_id": "AE_LFP.Cell.Volume [m3]",
    "dataset_id": "AE_LFP",
    "section": "Cell",
    "name": "Volume [m3]",
    "value": 1.7e-05,
    "unit": "m3",
    "evidence_type": "mixed_not_resolved",
    "source_id": "S01",
    "source_blob_sha1": "bc4aa47b2747ccad2088b9b7cd7baf58298799d5",
    "uncertainty": null,
    "validity_domain": null,
    "note": "Source supplies no per-parameter uncertainty; do not interpret decimals as accuracy."
  },
  {
    "parameter_id": "AE_LFP.Electrolyte.Initial concentration [mol.m-3]",
    "dataset_id": "AE_LFP",
    "section": "Electrolyte",
    "name": "Initial concentration [mol.m-3]",
    "value": 1000,
    "unit": "mol.m-3",
    "evidence_type": "literature",
    "source_id": "S01",
    "source_blob_sha1": "bc4aa47b2747ccad2088b9b7cd7baf58298799d5",
    "uncertainty": null,
    "validity_domain": null,
    "note": "Electrolyte/separator informed by literature; exact per-entry provenance not fully resolved."
  },
  {
    "parameter_id": "AE_LFP.Electrolyte.Cation transference number",
    "dataset_id": "AE_LFP",
    "section": "Electrolyte",
    "name": "Cation transference number",
    "value": 0.259,
    "unit": null,
    "evidence_type": "literature",
    "source_id": "S01",
    "source_blob_sha1": "bc4aa47b2747ccad2088b9b7cd7baf58298799d5",
    "uncertainty": null,
    "validity_domain": null,
    "note": "Electrolyte/separator informed by literature; exact per-entry provenance not fully resolved."
  },
  {
    "parameter_id": "AE_LFP.Electrolyte.Conductivity [S.m-1]",
    "dataset_id": "AE_LFP",
    "section": "Electrolyte",
    "name": "Conductivity [S.m-1]",
    "value": "0.1297 * (x / 1000) ** 3 - 2.51 * (x / 1000) ** 1.5 + 3.329 * (x / 1000)",
    "unit": "S.m-1",
    "evidence_type": "literature",
    "source_id": "S01",
    "source_blob_sha1": "bc4aa47b2747ccad2088b9b7cd7baf58298799d5",
    "uncertainty": null,
    "validity_domain": null,
    "note": "Electrolyte/separator informed by literature; exact per-entry provenance not fully resolved."
  },
  {
    "parameter_id": "AE_LFP.Electrolyte.Diffusivity [m2.s-1]",
    "dataset_id": "AE_LFP",
    "section": "Electrolyte",
    "name": "Diffusivity [m2.s-1]",
    "value": "8.794e-11 * (x / 1000) ** 2 - 3.972e-10 * (x / 1000) + 4.862e-10",
    "unit": "m2.s-1",
    "evidence_type": "literature",
    "source_id": "S01",
    "source_blob_sha1": "bc4aa47b2747ccad2088b9b7cd7baf58298799d5",
    "uncertainty": null,
    "validity_domain": null,
    "note": "Electrolyte/separator informed by literature; exact per-entry provenance not fully resolved."
  },
  {
    "parameter_id": "AE_LFP.Electrolyte.Conductivity activation energy [J.mol-1]",
    "dataset_id": "AE_LFP",
    "section": "Electrolyte",
    "name": "Conductivity activation energy [J.mol-1]",
    "value": 17100,
    "unit": "J.mol-1",
    "evidence_type": "literature",
    "source_id": "S01",
    "source_blob_sha1": "bc4aa47b2747ccad2088b9b7cd7baf58298799d5",
    "uncertainty": null,
    "validity_domain": null,
    "note": "Electrolyte/separator informed by literature; exact per-entry provenance not fully resolved."
  },
  {
    "parameter_id": "AE_LFP.Electrolyte.Diffusivity activation energy [J.mol-1]",
    "dataset_id": "AE_LFP",
    "section": "Electrolyte",
    "name": "Diffusivity activation energy [J.mol-1]",
    "value": 17100,
    "unit": "J.mol-1",
    "evidence_type": "literature",
    "source_id": "S01",
    "source_blob_sha1": "bc4aa47b2747ccad2088b9b7cd7baf58298799d5",
    "uncertainty": null,
    "validity_domain": null,
    "note": "Electrolyte/separator informed by literature; exact per-entry provenance not fully resolved."
  },
  {
    "parameter_id": "AE_LFP.Negative electrode.Particle radius [m]",
    "dataset_id": "AE_LFP",
    "section": "Negative electrode",
    "name": "Particle radius [m]",
    "value": 4.8e-06,
    "unit": "m",
    "evidence_type": "mixed_not_resolved",
    "source_id": "S01",
    "source_blob_sha1": "bc4aa47b2747ccad2088b9b7cd7baf58298799d5",
    "uncertainty": null,
    "validity_domain": null,